### ISSUE TITLE
Response for front page is slow

### ISSUE THREAD

**Issue by reynir** [robur-coop/builder-web#24]
The download speed of https://builds.robur.coop/ is in the tens of KB/s. Meanwhile fetching a binary such as https://builds.robur.coop/job/albatross/build/0cd3ce25-2884-4275-b390-a5409502ca36/f/bin/albatross.deb is several hundreds KB/s to one MB/s (which isn't great, but more acceptable).

My suspicion is the tyxml html pretty printer makes vif flush very small writes very frequently. It's possible this is fixed in vif already.

**Comment by reynir** [comment]
With tcpdump I see lots of small packets being sent. I suspect the issue will be resolved with a vif release since https://git.robur.coop/robur/vif/pulls/55 was merged.
```
12:27:31.483854 IP 192.168.0.14.3000 > 192.168.0.6.53730: Flags [P.], seq 75468:75469, ack 82, win 1027, length 1
12:27:31.483869 IP 192.168.0.14.3000 > 192.168.0.6.53730: Flags [P.], seq 75469:75470, ack 82, win 1027, length 1
12:27:31.483884 IP 192.168.0.14.3000 > 192.168.0.6.53730: Flags [P.], seq 75470:75472, ack 82, win 1027, length 2
12:27:31.483899 IP 192.168.0.14.3000 > 192.168.0.6.53730: Flags [P.], seq 75472:75474, ack 82, win 1027, length 2
12:27:31.483963 IP 192.168.0.14.3000 > 192.168.0.6.53730: Flags [P.], seq 75474:75478, ack 82, win 1027, length 4
12:27:31.483980 IP 192.168.0.14.3000 > 192.168.0.6.53730: Flags [P.], seq 75478:75480, ack 82, win 1027, length 2
12:27:31.483995 IP 192.168.0.14.3000 > 192.168.0.6.53730: Flags [P.], seq 75480:75562, ack 82, win 1027, length 82
12:27:31.484010 IP 192.168.0.14.3000 > 192.168.0.6.53730: Flags [P.], seq 75562:75564, ack 82, win 1027, length 2
12:27:31.484025 IP 192.168.0.14.3000 > 192.168.0.6.53730: Flags [P.], seq 75564:75567, ack 82, win 1027, length 3
12:27:31.484040 IP 192.168.0.14.3000 > 192.168.0.6.53730: Flags [P.], seq 75567:75569, ack 82, win 1027, length 2
12:27:31.484101 IP 192.168.0.14.3000 > 192.168.0.6.53730: Flags [P.], seq 75569:75572, ack 82, win 1027, length 3
12:27:31.484118 IP 192.168.0.14.3000 > 192.168.0.6.53730: Flags [P.], seq 75572:75573, ack 82, win 1027, length 1
12:27:31.484133 IP 192.168.0.14.3000 > 192.168.0.6.53730: Flags [P.], seq 75573:75574, ack 82, win 1027, length 1
12:27:31.484148 IP 192.168.0.14.3000 > 192.168.0.6.53730: Flags [P.], seq 75574:75577, ack 82, win 1027, length 3
12:27:31.484163 IP 192.168.0.14.3000 > 192.168.0.6.53730: Flags [P.], seq 75577:75578, ack 82, win 1027, length 1
12:27:31.484178 IP 192.168.0.14.3000 > 192.168.0.6.53730: Flags [P.], seq 75578:75580, ack 82, win 1027, length 2
12:27:31.484241 IP 192.168.0.14.3000 > 192.168.0.6.53730: Flags [P.], seq 75580:75584, ack 82, win 1027, length 4
12:27:31.484258 IP 192.168.0.14.3000 > 192.168.0.6.53730: Flags [P.], seq 75584:75589, ack 82, win 1027, length 5
12:27:31.484273 IP 192.168.0.14.3000 > 192.168.0.6.53730: Flags [P.], seq 75589:75590, ack 82, win 1027, length 1
12:27:31.484288 IP 192.168.0.14.3000 > 192.168.0.6.53730: Flags [P.], seq 75590:75591, ack 82, win 1027, length 1
12:27:31.484303 IP 192.168.0.14.3000 > 192.168.0.6.53730: Flags [P.], seq 75591:75634, ack 82, win 1027, length 43
12:27:31.484318 IP 192.168.0.14.3000 > 192.168.0.6.53730: Flags [P.], seq 75634:75636, ack 82, win 1027, length 2
```

**Comment by reynir** [comment]
It's fixed in vif now. On my 4G internet connection:

```shell
$ time curl https://builds.robur.coop/ >/dev/null
  % Total    % Received % Xferd  Average Speed   Time    Time     Time  Current
                                 Dload  Upload   Total   Spent    Left  Speed
100 63620    0 63620    0     0   116k      0 --:--:-- --:--:-- --:--:--  117k

real	0m0.562s
user	0m0.056s
sys	0m0.018s
```
